BOOK,PAGE,FEAT,Desc.,PREREQUISITES,BENEFIT,Jedi,Noble,Scoundrel,Scout,Soldier,TAG
R,35,Quick Comeback,"Whenever you are moved down the condition track by an attack that deals damage that equals or exceeds your damage threshold, until the end of your next turn you can move +1 step on the condition track as a single swift action. You can use this feat only once per attack that moves you down the condition track.",Gamorrean,when moved down CT can move +1 up CT until end of next turn,,,,,,"[species(gamorrean)], [damage threshold], [combat][defensive]"
CR,87,Quick Draw,"You can draw or holster a weapon as a swift action instead of as a move action. [If a Jedi has the Quick Draw feat and wanted to draw his lightsaber, he does not have to use another swift action to activate the lightsaber. The ""draw a weapon"" action normally includes everything necessary to render that weapon immediately usable, including deactivating the safety on a blaster pistol and activating a lightsaber or vibroblade.]",BAB +1,draw weapon as swift action instead of move action,x,,x,,x,"[ranged(grenade, fired, thrown)][ok], [melee(armed)][ok], [combat]"
K,31,Quick Draw + Dual Weapon Mastery I,"You can draw or holster two weapons with a single swift action; you must have both hands free to draw both weapons, and each weapon must be able to be held in one hand. ","Combo, requires Dual Weapon Mastery I",draw or holster 2 weapons as single swif action,,,,,,"[ranged(grenade, fired, thrown)][question gtdw], [melee(armed)], [combat][offensive], [combo]"
K,31,Quick Draw + WP (lightsabers),You can draw and ignite your lightsaber as a single swift action. ,"Combo, requires proficiency in lightsabers",draw and ignite lightsaber as single swif action,,,,,,"[melee(armed)], [combat][offensive], [combo]"
K,34,Quick Skill,"Once per encounter, you can take 10 when rushed on a single skill check for a skill you are trained in, unless the skill description explicitly forbids it. Alternatively, you can take 20 when using a skill you are trained in at half the normal time required. Normal: Taking 20 normally requires 20 times the amount of time needed by a regular skill check.",,"Once per encounter, can take 10 when rushed, can take 20 in half time",,x,x,,,[skill(general)]
L,36,Rancor Crush,"When you successfully pin an enemy with the Pin feat (see page 87 of the Saga Edition core rulebook) and use the Crush feat at the same time, the enemy moves -1 step down the condition track in addition to taking damage. Normal: The Crush feat deals damage to a grappled enemy but does not move the enemy along the condition track.","Str 15, Crush, Pin, BAB +1","when you Pin an opponent & use Crush feat, target -1 CT",,,,,x,"[melee(unarmed)], [grapple], [combat][offensive], [pin], [strength]"
R,29,Rapid Reaction,"Once per encounter, you can use two different reactions in response to the same trigger. For example, if you use the Deflect talent and fail to negate the attack, you can also use negate energy as a response to the same attack. Normal: Without this feat, you can use only one reaction in response to a particular trigger.",,1/enc you can use two different reactions to the same trigger,x,x,x,x,x,[combat][defensive]
CR,88,Rapid Shot,"When using a ranged weapon, you may fire two shots as a single attack against a single target. You take a -2 penalty on your attack roll, but you deal +1 die of damage with a successful attack. Special: Using this feat fires two shots and can only be done if the weapon has sufficient ammunition remaining. The effects of this feat do not stack with the extra damage provided by the Burst Fire feat (page 82) or Deadeye feat (page 84). If you do not have a Strength of 13 or higher, increase the penalty to attacks to -5 when using this feat with non-vehicle weapons. SSotG: This feat works normally with vehicle weapons. However, if you are using a missile or a torpedo and you miss with your attack roll, the projectile does not gain the benefit of this feat for the second attack roll. ","BAB +1, proficient with weapon*","-2 Atk for +1 die dam, ranged, fires 2 shots, if no Str 13 extra Atk -5",,,x,x,x,"[ranged(grenade, fired, thrown)][question gtmulti], [combat][offensive], [strength],  [vehicle][starship][SotG]"
CR,88,Rapid Strike,"When using a melee weapon, you may make two strikes as a single attack against a single target. You take a -2 penalty on your attack roll, but you deal +1 die of damage with a successful attack. The effects of this feat do not stack with the extra damage provided by the Mighty Swing feat. Special: If you do not have a Dexterity of 13 or higher, increase the penalty to attacks to –5 when using this feat with non-light weapons. [[Does not work with Whirlwind Attack.]]","BAB +1, proficient with weapon*","-2 Atk to deal +1 die damage, melee, if no Dex 13 extra -5 Atk",x,,,,x,"[melee(armed, unarmed)][question ulswp], [combat][offensive], , [dexterity]"
F,34,Rapport,"When using the aid another action, you grant an additional +2 insight bonus on skill checks and attack rolls to the character you are assisting. This bonus does not stack with any bonus provided by the noble's Coordinate talent.",,"additional +2 aid another, does not stack with Coordinate",,x,,,x,[support]
R,35,Read the Winds,You ignore concealment and cover for the purposes of Perception checks against targets within 10 squares of you.,Kel Dor,ignore concealment & cover for Perception w/in 10 sq,,,,,,"[species(kel dor)], [skill(perception)])"
R,30,Rebel Military Training,"Whenever you use the Running Attack feat to move both before and after making an attack, you gain a +2 dodge bonus to your Reflex Defense until the start of your next turn.","Running Attack, DEX 13",if move before & after attack +2 Ref Def,,,,x,x,"[mobility], [combat][defensive]"
F,35,Recall,"Once per day, you can reroll any check for a Knowledge skill that you are trained in, using the better result.",Trained in one Knowledge skill,"Once per day, reroll trained Knowledge check, taking best",,x,,,,[skill(knowledge)]
R,30,Recovering Surge,"When you catch a second wind, you move +1 step on the condition track.",,move +1 up CT when catch Second Wind,x,x,x,x,x,"[second wind], [combat][defensive]"
GI,28,Recurring Success,"When you select this feat, choose one talent or feat that can normally be used only once per encounter. You can use that talent or feat one additional time per encounter. You can select this feat multiple times. Each time you do so, you must choose a different skill to gain the benefits of this talent. [[Cannot be used with talents that allow for 3 actions]]",,choose one talent or feat. That feat may be used once more /enc,,,,,,[talent][feat]
R,35,Regenerative Healing,"Once per day when you catch a second wind, you can regain no hit points immediately and instead regain 5 hit points at the end of each of your turns until you reach full hit points or until the end of the encounter (whichever comes first).",Trandoshan,1/day with Second Wind regain no hp but gain 5 hp at end of each turn,,,,,,"[species(trandoshan)], [second wind]"
J,23,Relentless Attack,"Choose one weapon group or exotic weapon for which you have the Double Attack feat. Whenever you miss a target with that weapon, you gain a +2 competence bonus on your next attack roll made before the end of your next turn against the missed target. Special: You can select this feat multiple times. Each time you select this feat, it applies to a different weapon group or exotic weapon.","Proficient with weapon used*, Double Attack with weapon used, BAB +6","if miss, add +2 on next atk roll before end of next turn against missed",,,,,,"[ranged(fired, thrown)][target][question gtmulti], [question gtda], [melee(armed, unarmed)][question ulswp], [combat][offensive]"
K,35,Republic Military Training,"Once per encounter, as a reaction, you gain DR 10 against an incoming attack if you have cover from the attacker. You can gain the DR as long as you have cover, even if your opponent uses aim to ignore your cover bonus to Reflex Defense.",,"Once per encounter as reac, gain DR10 if you have cover even v. aim",,,,,,[combat][defensive]
GW,25,Resilient Strength,You can use either your Strength modifier or your Constitution modifier to determine your Fortitude Defense.,Str 13,can use Str or Con mod to determine Fort Def,x,,,x,x,"[strength], [constitution], [fortitude defense], [defensive]"
GI,28,Resolute Stance,"When you fight defensively, you gain a +2 morale bonus to your Will Defense. If you make no attacks until your next turn, you gain a +5 morale bonus to your Will Defense until the start of your next turn. Normal: When you fight defensively, you gain a +2 dodge bonus to your Reflex Defense. If you make no attacks until your next turn, you gain a +5 dodge bonus to your Reflex Defense until the start of your next turn.",BAB +1,fight defensively to gain +2 or +5 to Will Def with no attacks,x,,,,x,"[Will Defense], [combat][defensive]"
SV,24,Resurgence,"When you catch your second wind, you immediately gain a move action to be used immediately.",Trained in Endurance,catch second wind & immediately gain immediate move action,x,,,x,x,"[skill(endurance)], [second wind], [mobility], [combat][defensive]"
R,35,Resurgent Vitality,"Whenever you catch a second wind, you regain an additional number of hit points equal to twice your Constitution bonus (minimum 2).",Wookiee,with Second Wind gain additional hp = twice Con bonus (min 2),,,,,,"[species(wookiee)], [second wind], [combat][defensive]"
L,37,Return Fire,"Select one exotic weapon or weapon group. Once per encounter as a reaction, you can make a single ranged attack with the chosen weapon or group against an enemy that misses you with a ranged attack, provided you have line of sight to that enemy. Special: If you have the Combat Reflexes feat, you may use this feat a number of times during an encounter equal to your Dexterity bonus, but no more than once during a given enemy's turn. This feat does not apply to vehicle weapons or heavy weapons. You must have your weapon in hand to use this feat. You can gain this feat multiple times. Each time you take the feat, it applies to a different weapon group or exotic weapon.","DEX 15, Quick Draw, Weapon Focus (chosen exotic ranged weapon or weapon group), BAB +1",1/enc as reac ranged atk v. target that missed you w/ranged atk in LOS,,x,x,x,,"[ranged(grenade, fired, thrown)][ranged attack], [combat][offensive], [defensive], [dexterity]"
L,37,Returning Bug,"When you miss with a razor bug or a thud bug (see page 64), the weapon returns to your hand immediately.",Proficient with weapon used*,if you miss with razor or thud bug it automatically returns,,x,x,,,"[thrown], [combat][offensive]"
GW,25,Riflemaster,"When you make a ranged attack with a rifle, you gain one of the following benefits, depending on the kind of rifle you use. Blaster Carbine: You can brace a blaster carbine set to autofire, even though it is not an autofire-only weapon. Blaster Rifle: You treat the blaster rifle as an accurate weapon. Heavy Blaster Rifle: When you use a heavy blaster rifle, the damage dice increase from d10 to d12. Light Repeating Blaster: You treat the light repeating blaster as if it were Medium instead of Large.",Proficient with weapon used*,"Blaster Carbine can brace set to autofire, Blaster Rifle is accurate, Heavy Blaster Rifle dam dice d12, Light Repeating Blaster as if M not L",,,,x,x,"[ranged(fired)], [combat][offensive], "
GW,25,Risk Taker,"You fall only if you fail a Climb check by 10 or more. Additionally, if you make a Jump check and fail to land on a safe or solid surface (such as if you fall into a pit or fail to clear a stream of lava), you can spend a Force Point as a free action and add the result of the Force Point roll to your distance jumped. However, you must land in the first available safe square. Normal: You fall if you fail a Climb check by 5 or more.",Trained in Climb or Jump,"fall only if fail by 10 or more & make Jump to land safely, can spend FP & add to distance jumped & must land on solid surface",x,,,x,x,"[skill(climb)], [skill(jump)]"
CR,88,Running Attack,"When making an attack with a melee or ranged weapon, you can move both before and after the attack, provided that your total distance moved is not greater than your speed. [[Can be used by a mount. wording implies one single attack; not compatible with charge or multiple attacks, even if you have an ability that allows for multiple attacks as a standard action. I don't think it's compatible with lightsaber form powers. Once you activate your lightsaber form power as a standard action, the target is usually ""one enemy within your reach."" I think that means, One enemy within your reach at the time you activate the power. Therefore, you can't activate the power if you're not within melee reach of your target, and then use Running Attack to get to your target. On the other hand, it can be argued that as along as you're making an attack, the fact that it is the result of a Force power is irrelevant. It can also be argued that as long as you're making a melee or ranged attack, then it doesn't matter if you make more than one attack.]]",Dex 13,"move before and after an attack, cannot exceed speed",x,,x,x,x,"[ranged(grenade, fired, thrown)][attack roll], [melee(armed, unarmed)][question ulswp], [mobility], [combat][offensive], , , [dexterity]"
K,31,Running Attack + Dodge,You can add your Dodge bonus to your Reflex Defense against anyone who makes an attack of opportunity against you while using the Running Attack feat. ,"Combo, requires Dodge",add Dodge bonus to Ref Def v. Atk of opp,,,,,,"[ranged(grenade, fired, thrown)][attack roll], [melee(armed, unarmed)][question ulswp], [mobility], [combat][defensive][offensive], [combo], [dexterity]"
GI,28,Sadistic Strike,"When you deliver a coup de grace to a helpless creature, all opponents within line of sight move -1 step on the condition track until the end of the encounter.",,when you deliver a coup de grace all enemies in LOS move -1 CT until end of enc,,x,x,,x,"[ranged(fired)][question gtaoo], [melee(armed, unarmed)], [combat][offensive], [damage]"
F,35,Savage Attack,"Choose one of the weapon groups or exotic weapons you selected for the Double Attack feat. When you use a full attack action and successfully hit the target with your first attack, you deal +1 die of damage on each successful attack remaining in the full attack action made against that target.","Double Attack (chosen weapon), proficient with weapon*, BAB +6","with full attack if hit on first attack, +1 die dam v. same target",x,,,,x,"[ranged(fired, thrown)][target], [question gtmulti], [melee(armed, unarmed)][question ulswp], [combat][offensive]"
F,35,Scavenger,"You can spend 1 hour scavenging materials from other vehicles or objects. When you do so, you make a Perception check to determine the value of the parts scavenged. You produce raw materials equal in value to the result of your Perception check x 30 credits. You must apply these raw materials toward the cost of construction of a single object (see the build object application of the Mechanics skill, described on FU page 30), and you can scavenge parts for only a single object at any given time. Additionally, you can scavenge raw materials only once for any given object you are attempting to build.",,"1 hour scavenging, Perception check to determine value",,,x,,,"[skill(perception)]), [skill(mechanics], [craft]"
R,35,Scion of Dorin,You gain a +5 species bonus to your Fortitude Defense against all natural hazards.,Kel Dor,+5 Fort Def v. natural hazards,,,,,,"[species(kel dor)], [fortitude defense], [defensive]"
SGD,24,Sensor Link,"As a swift action, you can broadcast the input from your audio, visual, and any special sensors to a droid ally, com link, communications system, or holographic receiver within 24 squares. That ally is aware of anything you are aware of, and can use the aid another action to aid on your Perception checks even if you do not have line of sight to one another. lf both you and your ally have Sensor Link, you share information simultaneously, granting a +2 bonus to Perception checks. Special: Cyborgs with built-in cybernetic sensors and communications gear can also take this feat.",Droid or cyborg with associated hardware,"as swif broadcast input to any receiver in 24 sq as if they were with you, allies can use aid another on Perception",,,,,,"[species(droid)], [species(cyborg)], [skill(perception)]"
C,31,Separatist Military Training,"While you are adjacent to at least one of your allies, gain a +1 circumstance bonus on any one attack roll you make on your turn.",,+1 Atk to one attack if adjacent to ally,,,,,x,"[ranged(grenade, fired, thrown)][attack roll], [melee(armed, unarmed)], [combat][offensive]"
CR,88,Shake It Off,"You can spend two swift actions instead of three swift actions to move +1 step along the condition track (see Conditions, page 148). Normal: It takes three swift actions to move +1 step along the condition track.","Con 13, trained in Endurance",spend two swift actions to move +2 up condition track,,,,,x,"[skill(endurance)], [constitution]"
R,35,Sharp Senses,"Whenever you spend a Force Point to add to a Perception check, increase the die type by two steps (from d6 to d10, or from d8 to d12).",Mon Calamari,"when spend Force Point to Perception, increase die type by 2 steps",,,,,,"[species(mon calamari)], [skill(perception)])"
SGD,25,Shield Surge,"As a reaction, when your vehicle takes damage above its shield rating, after the shield rating is reduced you can reduce the amount of damage sustained by the vehicle by an amount up to the remaining shield rating (see page 161 of the Saga Edition core rulebook) . However, the shield rating is immediately reduced by one point for every point of damage reduced. Special: The Recharge Shields action cannot be used on the vehicle until a full round after the use of Shield Surge.","Droid or cyborg with scomp link or similar direct data link with the vehicle, trained in Mechanics skill.","as reac if dam over SR reduce dam to vehicle by remaining SR amount & SR reduced by same amount, recharge shields can't be used for 1 full rnd",,,,,,"[species(droid)], [species(cyborg)], [skill(mechanics)], [combat][defensive], [vehicle][starship]"
R,35,Shrewd Bargainer,"Whenever you make a Persuasion check against a target's Will Defense, the target does not receive the benefit of insight or morale bonuses to its Will Defense.",Quarren,when you use Persuasion target does not receive bonuses to Will Def,,,,,,"[species(quarren)], [skill(persuasion)]"
SV,24,Signature Device,"You designate a single weapon, suit of armor, vehicle, or other item as your signature item. When making Mechanics checks to modify that piece of equipment, you can take 10 on the check. In addition, you can allow the device to gain two traits from the Tech Specialist feat. To install the second trait, you must succeed on a DC 30 Mechanics check. Once installed, the device can use only one trait at a time, and switching from one trait to the other requires a swift action to adjust the item's settings. You can have only one signature device at a time, but you can designate another device as your signature item (the former signature item loses all benefit gained from this feat). [[This feat works with Superior Tech, because Superior Tech speficially says it replaces the Tech Specialist functions.]]",Tech Specialist,"one item two traits from Tech Spec, switch between with swif",,x,x,,,"[skill(mechanics], [tech specialist], [craft]"
GI,29,Silver Tongue,You can intimidate a creature or change its attitude as a standard action. Normal: Intimidating a creature or changing its attitude requires a full-round action.,Trained in Persuasion,Intimidate or change attitude as a standard not full,,x,x,,,[skill(persuasion)]
K,35,Sith Military Training,"Once per encounter, as a reaction when you reduce a target to 0 hit points or deal damage that exceeds the target's damage threshold, you can activate this feat to cause all enemies within 6 squares of that target to take a -2 to defenses until the end of your next turn. This is a mind-affecting effect.",,"1/encounter, if reduce opp to 0hp or over thresh, w/in 6sq of opp -2 def",,,,,,"[ranged(grenade, fired, thrown)][question range], [melee(armed, unarmed)], [combat][offensive], ([u])"
GI,29,Skill Challenge: Catastrophic Avoidance,"Once per skill challenge that has a chance of catastrophic failure, this failure occurs only if you fail a skill check by 15 or more. In addition , when a catastrophic failure occurs, you accrue one failure in the skill challenge, not two. Special: This feat is allowed only in campaigns that use the skill challenge rules described in Chapter 2.",,"1/challenge catastrophic fail only by 15, and only 1 failure, not 2",,,,,,[skill challenge]
GI,29,Skill Challenge: Last Resort,"Once per skill challenge, when you or an ally accrues a third failure (which would normally end the skill challenge), you or the ally can reroll the attempt, keeping the better result. Special: This feat is allowed only in campaigns that use the skill challenge rules described in Chapter 2.",,"1/challenge if third failure accrues, you or ally can reroll & keep better",,,,,,[skill challenge]
GI,29,Skill Challenge: Recovery,"Once per skill challenge, you treat the challenge as if it had the recovery effect, even if it does not have that effect. Special: This feat is allowed only in campaigns that use the skill challenge rules described in Chapter 2.",,1/challenge treat the challenge as if it had the recovery effect ,,,,,,[skill challenge]
CR,88,Skill Focus,"You gain a +5 competence bonus on skill checks made with one trained skill of your choice. Special: This feat may be selected multiple times. Its effects do not stack. Each time you take this feat, it applies to a different trained skill.",,+5 on a trained skill,x,x,x,x,x,[skill(general)]
CR,88,Skill Training,"Choose one untrained skill from your list of class skills. You become trained in that skill. Special: This feat may be selected multiple times. Each time you take this feat, it applies to a different class skill.",,become trained in one class skill,x,x,x,x,x,[skill(general)]
SGD,25,Slammer,"As a standard action, you slam two of your appendages together from either side of an enemy, crushing your target between them. Make a melee attack. If the attack is successful, you deal unarmed damage with double your Strength bonus. If you also exceed the target's damage threshold, it has a persistent condition that can be removed only with 8 hours of rest or a DC 20 Treat Injury check (not need to be trained-only). Special: If you also have the Crush feat, increase your unarmed damage by 1 die when using Slammer.","Small or larger droid with 2 appropriate appendages, Str 13","as stan action slam 2 appendages crushing target, deal unarmed dam w/Str bonus x2 & if over thresh = persistent condition",,,,,,"[melee(unarmed)], [strength], [species(droid)], [combat][offensive]"
GW,29,Slicer Team (team feat),"You gain a +3 competence bonus to Use Computer checks. At the time you make a check, for each ally within 12 squares of you who also has this feat, the competence bonus increases by 1 (to a maximum of +7). Additionally, when you use the aid another action to assist an ally who has this feat with a Use Computer check, you provide a bonus of +4 instead of +2.",Trained in Use Computer,"+3 Use Computer & +1 each ally w/feat w/in 12 sq (max +7), aid another provides +4",,,,,,"[skill(use computer)], [team], [support]"
SV,24,Slippery Maneuver,"You can apply the effects of the Dodge feat against attacks made from two opponents. In addition, when you use the withdraw action to move away from a target against whom you use the Dodge feat, you can move at your full speed. You still provoke an attack of opportunity if you must move more than 1 square to escape a threatened area. Normal: The benefit of Dodge applies to one target. Once you clear a threatened area, you can continue to move up to a total of half your speed.","Dodge, DEX 13","apply Dodge to two opp, use withdraw at full spd v. Dodge opp",x,,,x,x,[combat][defensive]
CR,88,Sniper,"You always ignore soft cover (that is, cover provided by a character, creature, or droid) when you make a ranged attack. Normal: You can only ignore cover if you aim (see page 154) before making a ranged attack.","BAB +4, Point Blank Shot, Precise Shot",ignore soft cover making a ranged attack,,,,x,x,"[ranged(fired, thrown)][target], [combat][offensive], "
K,35,Sniper Shot,"When wielding only weapons with which you are proficient, you can gain a +2 bonus on your ranged attack, but you take a -5 penalty to Reflex Defense until the beginning of your next turn. The bonus to attacks applies to all attack rolls made until the beginning of your next turn. Special: This feat cannot be used with vehicle weapons or heavy weapons.",Proficient with ranged weapon*,"+2 ranged Atk, -5 Ref Def, not with vehicle or heavy weapons",,,x,,x,"[ranged(grenade, fired, thrown)][ranged attack], [combat][offensive], "
R,35,Spacer's Surge,"Whenever you roll a natural 20 on a Pilot check, you gain 1 temporary Force Point. If that Force Point is not spent before the end of the encounter, it is lost.",Duros,"when roll Nat 20 on Pilot check, gain Force Point to use before end of enc",,,,,,"[species(duros)], [skill(pilot)], [vehicle][starship]"
