BOOK,PAGE,FEAT,Desc.,PREREQUISITES,BENEFIT,Jedi,Noble,Scoundrel,Scout,Soldier,TAG
T,64,A Few Maneuvers,"When piloting a vehicle of Colossal size or smaller, you grant a +2 dodge bonus to your vehicle's Reflex Defense. Furthermore, if you are the target of a missile or torpedo attack and the attack roll misses by 5 or more, the projectile self-destructs harmlessly.","DEX 13, Dodge, Vehicular Combat, Trained in Pilot","Ref Def +2 in Colossal or smaller vehicle, if projectile misses by 5",,,,,,"[combat][defensive], [vehicle][starship]"
K,32,Accelerated Strike,"Once per encounter, when using only weapons with which you are proficient, you can take a full attack action as a standard action. [[NOTE: This feat does not allow the use of full-round attacks (such as Whirlwind Attack) as standard actions. Full attack actions are usually feats that provide extra attacks, such as Dual Weapon Mastery, Double Attack, and Triple Attack.]]",BAB +6,"Once per encounter, full attack as stan",x,,,,x,"[melee(armed, unarmed)][question ulswp], [combat][offensive], "
UR,24,Acrobatic Ally,"You can hoist or toss an ally of your size or smaller up to 2 squares. You and your ally must act on the same initiative number and start in adjacent squares. If you succeed on a DC 20 Acrobatics check as a standard action, your ally ends up in a square of your choosing up to 2 squares above or away from you. This counts as a free action for your ally and ends your turn. Your ally can then continue his or her turn. If you fail your check, both you and your ally immediately become prone in your square. Your turn is ended, but your ally can take his or her turn normally. Special: This feat can provoke attacks of opportunity against either character.","Dex 13, Str 13, trained in Acrobatics","hoist or toss ally 2sq on DC20 Acrobatics as stan, free for ally, your turn ends",,,x,,,"[dexterity][strength], [skill(acrobatics)], [support], [combat]"
UR,24,Acrobatic Dodge,"Once per encounter, as a reaction, if a melee attack misses you, you can immediately move into an adjacent square without provoking an attack of opportunity. Special: You must be aware of the attacker to benefit from this feat. You can use this feat a second time during the encounter by spending a Force Point.","DEX 13, Dodge, Mobility, Skill Focus (Acrobatics), trained in Acrobatics",1/enc as reac if melee atk misses you can move into adjacent w/out AoO,,,x,,,"[dexterity], [skill(acrobatics)], [mobility], [combat][defensive]"
CR,82,Acrobatic Strike,"If you succeed in tumbling to avoid an attack of opportunity (see the Acrobatics skill, page 62), you gain a +2 competence bonus on the next attack that you make against that foe as long as the attack occurs before the end of your current turn.",Trained in Acrobatics,Gain +2 on next attack against opponent you tumble past,x,,,,,"[melee(armed, unarmed)][ok], [combat][offensive], [skill(acrobatics)], tumble"
GI,25,Adaptable Talent,"Choose one talent that you meet the prerequisites for, from a class you possess. Once per day, after at least 6 hours of rest, you can choose to swap out one of your current talents for the talent you chose for this feat. The talent you swap out cannot be the prerequisite for any other talent you have. You can swap back to your original talent after at least 6 hours of rest.",,"Choose talent from your classes, and swap that talent 1/day w/6 hrs rest",,,,,,[talent]
F,31,Advantageous Attack,"When you make a successful attack against an enemy who has not yet acted in combat, you add your full heroic level to damage rolls. Normal: Typically you add only one-half your heroic level to damage rolls.",BAB +1,"if opponent has not yet acted, add full heroic level to damage",,,x,x,,"[ranged(fired, thrown)][target], [melee(armed, unarmed)], [combat][offensive]"
F,31,Advantageous Cover,"When you have cover, you take no damage from area attacks, even if the attack roll exceeds your Reflex Defense. Normal: You take no damage from area attacks when you have cover only if the attack roll misses.",Trained in Stealth,"when you have cover, take no damage from area attacks",,,x,x,x,"[combat][defensive], [skill(stealth)]"
SGD,22,Aiming Accuracy,"If you aim at a target as a full-round action (instead of two swift actions), you gain a +5 bonus to your next attack made in the following round against that target. The target must remain in your line of sight.","Droid, Point Blank Shot, Precise Shot, proficient with weapon.",if aim as full-round gain +5 atk against target if remains in LOS,,,,,," [species(droid)], ranged(fired, thrown)][target], [combat][offensive]"
R,31,Ample Foraging,"Whenever you make a Survival check for the Basic Survival application of the skill, each creature that consumes the food you find gains a +2 morale bonus to his or her Fortitude Defense until the start of the next day.",Ewok,"Basic Survival of Survival, each gets +2 Fort Def until start next day",,,,,,"[species(ewok)], [skill(survival)], [fortitude defense], [defensive]"
F,32,Angled Throw,"When throwing a grenade or grenade-like weapon, you can attempt to bounce it off a wall or other surface close to your target. If your attack roll exceeds a Reflex Defense of 15, you ignore cover and improved cover (but not total cover) with your attack.",Dex 13,"if Atk exceeds Ref Def 15, ignore cover and improved cover",,,,,x,"[ranged(grenade)], [combat][offensive], [dexterity]"
C,28,Anointed Hunter,"If you end your move at least 2 squares from where you started, you gain a +1 competence bonus on attacks made with thrown weapons until the end of your turn.",Nelvaanian species,if end move 2 sq from start +1 Atk with thrown weapons,,,,,,"[thrown], species(Nelvaanian), [combat][offensive]"
GW,28,Aquatic Specialists (team feat),"You gain a +3 competence bonus to Swim checks. At the time you make a check, for each ally within 12 squares of you who also has this feat, the competence bonus increases by 1 (to a maximum of +7). Additionally, when you swim, you swim at half speed as a move action (or you swim at your speed as a full-round action).",Trained in Swim,"+3 Swim & +1 each ally w/feat w/in 12 sq (max +7), swim half spd as move",,,,,,"[skill(swim)], [team], [support]"
CR,82,Armor Proficiency (heavy),"When you wear heavy armor, you take no armor check penalty on attack rolls or skill checks. Additionally, you benefit from all of the armor's special equipment bonuses (if any). Normal: A character who wears heavy armor with which she is not proficient takes a -10 armor check penalty on attack rolls as well as skill checks made using the following skills: Acrobatics, Climb, Endurance, Initiative, Jump, Stealth, and Swim. Additionally, the character gains none of the armor's special equipment bonuses.","Armor Proficiency (light), Armor Proficiency (medium)",no penalty or armor check from armor,,,,x,x,"[armor], [combat][defensive]"
CR,82,Armor Proficiency (light),"When you wear light armor, you take no armor check penalty on attack rolls or skill checks. Additionally, you benefit from all of the armor's special equipment bonuses (if any). Normal: A character who wears heavy armor with which she is not proficient takes a -2 armor check penalty on attack rolls as well as skill checks made using the following skills: Acrobatics, Climb, Endurance, Initiative, Jump, Stealth, and Swim. Additionally, the character gains none of the armor's special equipment bonuses.",,no penalty or armor check from light armor,,x,,x,,"[armor], [combat][defensive]"
CR,82,Armor Proficiency (medium),"When you wear medium armor, you take no armor check penalty on attack rolls or skill checks. Additionally, you benefit from all of the armor's special equipment bonuses (if any). Normal: A character who wears medium armor with which she is not proficient takes a -5 armor check penalty on attack rolls as well as skill checks made using the following skills: Acrobatics, Climb, Endurance, Initiative, Jump, Stealth, and Swim. Additionally, the character gains none of the armor's special equipment bonuses.",Armor Proficiency (light),no penalty or armor check from light or medium armor,,,,x,,"[armor], [combat][defensive]"
C,28,Artillery Shot,"When you make an attack with a burst or splash weapon against a target at greater than point blank range, you can affect two additional adjacent squares to the normal burst or splash area.",Proficient with weapon used*,affect +2 sq with burst or splash at further than PB range,,,,,x,"[ranged(grenade, fired, thrown)][burst][o][splash][o], [combat][offensive], [vehicle][starship]"
GW,28,Ascension Specialists (team feat),"You gain a +3 competence bonus to Climb checks. At the time you make a check, for each ally within 12 squares of you who also has this feat, the competence bonus increases by 1 (to a maximum of +7). Additionally, when you climb, you climb at half speed as a move action (or at your normal speed as a full-round action).",Trained in Climb,"+3 Climb & +1 each ally w/feat w/in 12 sq (max +7), climb half spd as move",,,,,,"[skill(climb)], [team], [support]"
W,,Assault,"If you are wielding two weapons or a weapon with which you can use the Double Attack feat, you may spend a Force Point to make two attacks as a standard action. The normal penalties due to attacking with two weapons or using Double Attack still apply, and you cannot make more than two attacks regardless of how many extra attacks you can make during a full attack action. Normal: You can only make multiple attacks with the full attack action (a full-round action).","Double Attack or Dual Weapon Mastery I, BAB +6",spend FP to make 2 Atk as stan action not full,,,,,,"[ranged(grenade, fired, thrown)][question gtmulti], [melee(armed, unarmed)][question ulswp], [combat][offensive]"
R,28,Assured Attack,"Whenever you deal damage to a target with an attack and you roll multiple damage dice, you can reroll the lowest damage die but must keep its second result, even if it is worse.",,"reroll lowest damage die if roll multiple dice, must take reroll",x,,,,x,"[ranged(fired, thrown)][target], [melee(armed, unarmed)], [combat][offensive]"
L,34,Attack Combo (Fire & Strike),"If you hit a single target with two consecutive ranged, melee, and/or unarmed attacks during the same turn, any additional ranged, melee, or unarmed attacks you make until the end of your next turn (including attacks of opportunity and attacks made as reactions) deal +1 die of damage on a hit. This extra damage stacks with extra damage granted by other feats or talents.","Attack Combo (Melee), Attack Combo (Ranged), BAB +9","if hit single target with 2 consecutive atks in same turn, additional atks +1 die dam",,,,,x,"[ranged(fired, thrown)][target], [melee(armed, unarmed)], [combat][offensive], , "
L,34,Attack Combo (Melee),"If you hit a single target with two consecutive melee and/or unarmed attacks during the same turn, any additional melee or unarmed attacks you make until the end of your next turn (including attacks of opportunity and attacks made as reactions) deal +1 die of damage on a hit. This extra damage stacks with extra damage granted by other feats or talents.",BAB +3,"if hit single target with 2 consecutive melee or unarmed atks in same turn, additional atks +1 die dam",x,,,,x,"[melee(armed, unarmed)][ok], [combat][offensive], , [unarmed attack]"
L,34,Attack Combo (Ranged),"If you hit a single target with two consecutive ranged attacks during the same turn, any additional ranged attacks you make until the end of your next turn (including attacks of opportunity and attacks made as reactions) deal +1 die of damage on a hit. This extra damage stacks with extra damage granted by other feats or talents.",BAB +3,"if hit single target with 2 consecutive ranged atks in same turn, additional atks +1 die dam",,,x,x,x,"[ranged(fired, thrown)][target], [combat][offensive], "
L,34,Autofire Assault,"When you target the same area with an autofire attack that you made an autofire attack against on your last turn, the penalty on the autofire attack is reduced to -2 (-1 if using a braced autofire-only weapon or the Controlled Burst talent) and you deal +1 die of damage on a hit. Normal: A -5 penalty applies to autofire attack rolls, and there are no bonuses for consecutive rounds of fire in the same squares. Special: This feat cannot be used with the Autofire Sweep feat or the Burst Fire feat.",Weapon Focus,"autofire penalty -2 if autofired to same target last round, +1 die dam",,,,,x,"[ranged(fired)], [autofire], [combat][offensive]"
L,34,Autofire Sweep,"When making an autofire attack, you can attack all targets in a 6-square cone. The origin square of the cone can be any square in your line of sight and within point-blank range. Normal: A -5 penalty applies to autofire attack rolls. Autofire attacks that miss deal half damage. Special: This feat cannot be used with the Autofire Assault feat or the Burst Fire feat. It can be used with the Improved Suppression Fire talent (see LE page 31). [[Fluff states ""You can sweep an area with your autofire weapon, spraying fire in a 180-degree arc in front of you.""]]",Weapon Focus,autofire as 6sq cone ,,,,,x,"[ranged(fired)], [autofire], [combat][offensive]"
F,32,Bad Feeling,"You can always take a move action during a surprise round, even if you are surprised. If you are not surprised, you can take this move action in addition to any other actions you are normally allowed to take in the surprise round.",,extra move action in surprise round even if not surprised,,,x,x,,"[mobility], [combat]"
GW,22,Bantha Herder,"When you damage a Large or smaller creature with a ranged attack, compare the result of your attack roll to the target's Will Defense. If your result equals or exceeds the target's Will Defense, you can move the target 1 square in any direction as a free action. If your ranged attack deals damage to multiple eligible creatures, you can use this benefit against all of them. You can't move a target that's being grabbed or grappled, and you can't move a target into a solid object or into another creature's fighting space. [Dev: Bantha Herder and Forceful Blast are meant to be mutually exclusive]
","Proficient with weapon used*, BAB +1",if dam a Large or smaller creature with a ranged atk compare to Will Def & can move target(s) 1 sq in any direction as free,,,x,,x,"[ranged(grenade, fired, thrown)][damage], [combat][offensive], [ranged attacks]"
CR,82,Bantha Rush,"After making a successful melee attack against an opponent up to one size category larger than you, you can choose to move that opponent 1 square in any direction as a free action. You can't bantha rush an opponent that's being grabbed or grappled, and you can't bantha rush your opponent into a solid object or another creature's fighting space. Unleashed: When you use the Bantha Rush feat, you can spend a Destiny Point to automatically increase the distance you move your target by 5 squares and knock your target prone.","Str 13, BAB +1",Push opponent 1 square after successful melee attack,,,,,x,"[melee(armed, unarmed)][ok], [combat][offensive], [strength], "
GW,23,Battering Attack,"Whenever you successfully move a creature with the Bantha Rush feat, you also knock that target prone.","STR 13, BAB +1, Bantha Rush, Trip",can knock target prone if you move target with Bantha Rush,x,,,,x,"[melee(armed, unarmed)][ok], [combat][offensive]"
R,31,Binary Mind,"Whenever an enemy tries to use a mind-affecting effect against you, the enemy must roll twice and keep the lower result.",Cerean,enemy must roll mind-affecting effects twice & keep lower,,,,,,"[species(cerean)], [Will Defense], [combat][defensive]"
L,34,Biotech Specialist,"You can modify a Yuuzhan Vong biotech-based device, suit of armor, weapon, or vehicle so that it gains a specific trait. Specific traits are listed in the chart on page 35. You can perform only one modification at a time. Unless noted otherwise, you cannot grant more than one benefit to a single device, suit of armor, weapon, or vehicle, and you cannot apply the same benefit more than once. Before beginning the modification, you must pay one-tenth the cost of the device, suit of armor, weapon, or vehicle you wish to modify or 1,000 credits, whichever is more. Completing the modification requires one day per 1,000 credits of the modification cost. At the end of this time, make a DC 20 Mechanics check; you can't take 10 or take 20 on this check. If the check succeeds, the modification is completed successfully, and the object gains the desired trait. If the check fails, you lose all credits spent making the modification, and the object doesn't gain the desired trait. However, you may start over if you wish. Due to the specialized nature of biotechnology, only other characters with the Biotech Specialist feat can assist you, reducing proportionately the time needed to complete the modification. At the end of the modification process, they can make a Mechanics check to aid your check. The market value of a modified item is equal to the base cost of the item + double the cost of the modifications made to it (not including credits wasted on failed modification attempts). 
BIOTECH ARMOR TRAIT: 
Agile Armor: The armor's maximum Dexterity bonus increases by 1. 
Fortifying Armor: The armor's equipment bonus to Fortitude Defense increases by 1. 
Protective Armor: The armor's armor bonus to Reflex Defense increases by 1. 
BIOTECH DEVICE TRAIT: 
Add Device to Creature: Alter a bioengineered creature to accept a biotech or standard technological enhancement such as a miniaturized sensor pack. 
Enhanced Strength: Increase the device's Strength score by 2. 
Improved Durability: The device's damage reduction increases by 1, and it gains extra hit points equal to one-quarter of its maximum hit points. 
Mastercraft Device: Skill checks made using the device gain a +1 equipment bonus, or the device's existing equipment bonus increases by 1. 
BIOTECH VEHICLE TRAIT: 
Dovin Basal Enhancement: Increase the effects of a dovin basal to grant one of the following benefits to a starship:  +1 additional square of movement at starship scale, +2 SR, or +1 die of damage when using a dovin basal. 
Enhanced Dexterity: Increase the vehicle's Dexterity score by 2. 
Improved Speed: Increases the vehicle speed by one-quarter of its base speed (minimum 1 square) 
BIOTECH WEAPON TRAIT:
Improved Accuracy: The weapon gains a +1 equipment bonus on attack rolls. 
Improved Damage: The weapon deals +2 points of damage on a successful hit. If the weapon has a damage multiplier (for example, 6d10x2), apply the extra damage before applying the multiplier. 
Selective Fire: An autofire-only ranged weapon can be set to fire single shots, or a single-shot ranged weapon that doesn't have a burst radius can be made to have an autofire mode. 
Special: Nobles and scoundrels may add this feat to their class list of bonus feats. This feat allows you to make Treat Injury checks on biotechnology without the -5 penalty.",Trained in Mechanics,modify a biotech item to give a special trait,,x,x,,,"[skill(mechanics], [craft]"
L,35,Biotech Surgery,"You can install a biotech prosthesis onto a living being. The surgical procedure takes 1 hour of uninterrupted work, after which you must make a DC 20 Treat Injury check. If the check succeeds, the prosthesis is installed correctly. If the check fails, the prosthesis is not installed properly; however, you can try again after another uninterrupted hour of surgery. Special: You can install a biotech prosthesis on yourself, but you take a -5 penalty on the Treat Injury skill check. If you have the Surgical Expertise feat (CR page 88), you can install a biotech prosthesis in 10 minutes instead of 1 hour.",Trained in Treat Injury,install biotech prosthesis,,x,,,,[skill(treat injury)]
F,32,Blaster Barrage,"When you make an attack with a weapon set on autofire that deals damage to at least one target within the designated area, you grant a +2 circumstance bonus on any of your allies' autofire attacks made against that same target until the beginning of your next turn.","Coordinated Attack, BAB +2",+2 Atk to allies with autofire if you're successful with autofire,,,,,x,"[ranged(fired)], [autofire], [combat][offensive]"
GI,25,Bone Crusher,"When you deal damage to a grappled opponent, the opponent also moves -1 step on the condition track.","Crush, Pin, BAB +1","When you deal damage to grappled target, move it -1 CT",,,,,x,"[melee(unarmed)], [grapple], [pin], [combat][offensive]"
R,31,Bothan Will,"Whenever an attack or skill check targets your Will Defense and fails to equal or exceed it, you gain a +2 circumstance bonus to your Will Defense until the start of your next turn.",Bothan,"if attack v. Will Def fails, gain +2 Will Def until start of your next turn",,,,,,"[species(bothan)], [Will Defense], [combat][defensive]"
R,31,Bowcaster Marksman,"Whenever you spend a Force Point to add to an attack with a bowcaster, if you hit the target, you gain a competence bonus to your damage roll equal to the amount added to the attack.",Wookiee,"when spend Force Point to atk w/bowcaster, add result to dam too",,,,,,"[ranged(fired)], [species(wookiee)], [bowcaster], [combat][offensive]"
GI,25,Brilliant Defense,"Once per encounter, you can add your Intelligence bonus to your Reflex Defense as a reaction; this benefit lasts until the start of your next turn.",Int 13,1/enc add Int mod to Ref Def as reac until your next turn,x,x,,,,"[intelligence], [reflex defense], [combat][defensive]"
L,35,Brink of Death,"When you deal sufficient damage on an attack to kill a target, you may instead choose to reduce the target to 0 hit points, leaving it unconscious but alive. Normal rules for being at 0 hit points apply (see CR page 146).",,"if you deal damage that kills, can reduce to 0 hp instead",x,,,,x,"[ranged(grenade, fired, thrown)][damage], [melee(armed, unarmed)], [combat][offensive]"
CR,82,Burst Fire,"When using a ranged weapon with autofire capability in autofire mode, you may fire a short burst as a single attack against a single target. You take a -5 penalty on the attack roll but deal +2 dice of damage. For example, a weapon that deals 3d10 points of damage deals 5d10 points of damage instead. The effects of this feat do not stack with the extra damage provided by the Deadeye or Rapid Shot feat. [[This is not an area attack]] Special: Firing a burst expends five shots and can only be done if the weapon has at least five shots remaining. If you do not have a Strength of 13 or higher, increase the penalty on attacks to –10 when using this feat with non-vehicle weapons. Normal: Autofire uses ten shots, targets a 2-square-by-2-square area, and can't be aimed at a specific target. Without this feat, if you attempt an autofire attack at a specific target, it simply counts as a normal attack and all the extra shots are wasted. SSotG: Vehicle weapons capable of autofire can be used with this feat normally. This is, in fact, the only time autofire attacks are useful in starship-scale combat. ","Weapon Proficiency (heavy weapons), proficient with weapon*","-5 on autofire Atk to gain +2 dice dam, 5 shots, if no Str 13 -10 Atk",,,,,,"[ranged(fired)], [autofire], [combat][offensive], [strength], [vehicle][starship][SotG]"
SV,21,Burst of Speed,"As a move action, you can move up to twice your speed. At the end of your movement, you move -1 step along the condition track.",Trained in Endurance,"move action to move twice speed, -1 CT at end",x,,x,x,x,"[skill(endurance)], [mobility], [combat]"
CR,82,Careful Shot,"If you aim before making a ranged attack (see Aim on page 154), you gain a +1 bonus on your attack roll. SSotG: Pilots can use these feats, but since they must spend at least one move action operating their vehicles, they must split their aim (two swift actions) and attack (standard action) into two separate turns, making it more likely that the target will break line of sight or otherwise avoid you. [[NOTE: Cannot use aim with area attacks.]]","BAB +2, Point Blank Shot","if you aim, +1 Atk",,,,x,x,"[ranged(grenade, fired, thrown)][ranged attack][question gtaim], [combat][offensive], [aim],  [vehicle][starship][SotG]"
GI,25,Channel Rage,"Once per day, instead of entering into a rage, you gain a +5 bonus to Will Defense until the end of the encounter. This bonus counts as using your rage ability for that day.",Rage,1/day expend use of Rage for +5 to Will Def for enc,,,,,,"[rage], [Will Defense], [combat][defensive]"
CR,82,Charging Fire,"When you charge, you may make a ranged attack instead of a melee attack at the end of your movement. Unlike a normal charge, your momentum does not help overcome your target, so you gain no bonus on attack roll. As with a normal charge, you still take a -2 penalty to your Reflex Defense. Normal: You can make a single melee attack with a +2 bonus on your attack roll at the end of a charge.",BAB +4,"make ranged Atk at end of charge, -2 to Ref Def",,,,,x,"[ranged(grenade, fired, thrown)][ranged attack], [mobility], [charge], [combat][offensive], "
K,31,Charging Fire + Dodge,You can reduce your penalty to your Reflex Defense against all opponents to -1 when making a ranged attack at the end of a charge.,"Combo, requires Dodge",Ref Def penalty -1 when making a ranged attack at end of charge,,,,,,"[ranged(fired, thrown)][target], [mobility], [charge], [combat][defensive][offensive], [combo], "
R,31,Clawed Subspecies,"You have natural weapons in the form of claws. When you make an unarmed attack, you can use your claws, dealing 1d6 points of slashing damage with that attack instead of normal unarmed damage. You are always considered armed with your natural weapons.",Quarren,gain claws 1d6 dam,,,,,,"[melee(unarmed)], [species(quarren)], [combat][offensive]"
